{
  "$schema": "./snowstorm-mcp.config.schema.json",
  "projectName": "my-vfx-package",
  "sharedTextureBanks": [],
  "particlesRoot": "../my-package/particles",
  "resourcePackRoot": "../my-package/resourcepack",
  "selectorsFile": "../my-package/selectors.json",
  "spellFile": "../my-package/spell.yml",
  "artifactsRoot": "./.snowstorm-mcp/artifacts"
}
